VideoId,Title,PublishedAt,ChannelId,ChannelTitle,CategoryId,ViewCount,LikeCount,DislikeCount,CommentCount
JM440iogvbc,ISAIAS SAAD - ÉS FIEL (AO VIVO),2023-11-22T20:00:10Z,UCxaYdMYNsCBJcFE9NicmVYg,Isaias Saad,Music,160025,10217,0,519
H4XL-Zi_v90,UMA NOITE PARA APAGAR! - Brasil perde da Argentina e o culpado tem nome!,2023-11-22T06:05:44Z,UCm1_S0MCQYO9EWukQoAcRFA,Canal GB,Sports,854547,67958,0,6112
RkzvCixHOVw,TRANSFORMEI O THE END EM OVERWORLD EM 100 DIAS NO HARDCORE,2023-11-22T14:00:22Z,UCgrFZP2B8H6pWgPL1bAqkiQ,Fixz,Gaming,498784,15389,0,376
UKEGCK-rnrE,DESCOMPLICANDO O HWEI: O NOVO MAGO DO LEAGUE OF LEGENDS!,2023-11-23T15:00:23Z,UC46L3Cku3SplGDbIAliRssA,Mylon,People & Blogs,206450,23990,0,403
cBD4PFXmYFQ,DRAGON BALL LEGENDS REVEALS & STUFF LEGENDS FESTIVAL EDITION 2023,2023-11-23T14:00:08Z,UCqly9F4Fr_jf2Y1Cy5hacRg,Bandai Namco Entertainment,Gaming,416677,0,0,0
OTPuSMB73s8,Fazendeiro Black distribui as tarefas entre peões | A Fazenda 15,2023-11-23T10:55:07Z,UCw4YGFtvDgOL09KrFpqj6kg,A Fazenda,Entertainment,248380,4623,0,0
6ndM5o5VJ9o,o primeiro vlog na casa nova!,2023-11-22T15:00:08Z,UCgpfg0lMsq_E7KjDG62YFTA,Vanessa Lino,People & Blogs,155737,20722,0,596
oYMTmTw9hbk,"""VOCÊS SÃO RESPONSÁVEIS POR RESULTADOS HORROROSOS!"" [Cortes do Opinião Placar]",2023-11-22T22:00:22Z,UC0skDBBv--leL2rK_r9pmYw,Placar TV,Sports,97598,3724,0,601
Bd-a_CDkN6U,ATEEZ(에이티즈) THE WORLD EP.FIN : WILL 'World Z' Track Preview,2023-11-23T05:00:02Z,UCQdq-lqPEq_yZ_wP_kuVB9Q,KQ ENTERTAINMENT,Music,441664,76781,0,3221
nkbfR4astZs,"Lixo LUXO dos meus VIZINHOS RICOS 🤩,deu a Louca nos Gringos dos EUA 🇺🇸",2023-11-22T21:33:23Z,UC77i_T1Lt_0bKOvnn4sPErg,Raquel Segal ,People & Blogs,47280,5960,0,571
3bxFvZZMV5M,ESSA ALIANÇA VAI DOMINAR O CAOS NA IRMANDADE,2023-11-22T21:45:00Z,UCfSCj6pb_AMSszt73mqgP_Q,Lggj,Gaming,151907,16428,0,606
tO9srYMZZzw,A CONVERSA FINAL COM O FEITICEIRO NO MINECRAFT#3.24,2023-11-22T13:00:09Z,UCV306eHqgo0LvBf3Mh36AHg,Felipe Neto,Entertainment,1352755,118435,0,6726
OKcRvqJlQog,Dreamcatcher(드림캐쳐) 'OOTD' MV,2023-11-22T09:00:00Z,UCijULR2sXLutCRBtW3_WEfA,Dreamcatcher official,Music,17659509,135922,0,14677
QirKvGGOJwg,EPISÓDIO 01 - 2/5: A estreia mais esperada! | TEMP 02 | MASTERCHEF + (21/11/2023),2023-11-22T08:01:00Z,UC2EWGw-KBjEReUbXMJEiaCA,MasterChef Brasil,Entertainment,901918,13242,0,479
DjHURxv1Cgc,COCIELO E O SEU PASSADO DE INIMIGO DA MODA KKKKKKKK,2023-11-21T21:00:08Z,UCU7uY3wCPh9j39KXzOpqNaw,Julio Cocielo,Gaming,388308,53144,0,554
vKTJ0Xu4OcQ,"MC RYAN E GIOVANNA ROQUE JUNTINHOS, FALANDO SOBRE A FILHA, ZOE!!! #matheusmazzafera",2023-11-21T20:00:22Z,UCL7Bgplfmp-9hF1ghndgxng,Matheus Mazzafera,People & Blogs,237772,11335,0,84
bDHz1nDLY10,POD ENTRAR - Tour inédito pela mansão do RJ de Jade Picon com Lucas Rangel,2023-11-20T15:01:10Z,UCuUUWPHIioyfmctnDpwsFzw,POD DELAS,People & Blogs,2433991,116346,0,4333
8jsi2Tgvx6A,björk ft. rosalía : oral,2023-11-21T14:00:31Z,UCFbRdRGijPR4oBjQ0fVCSmw,björk,Music,2623591,155866,0,7607
9AHHoRK1nQY,URUGUAY vs. BOLIVIA [3-0] | RESUMEN | ELIMINATORIAS SUDAMERICANAS | FECHA 6,2023-11-22T03:10:53Z,UCzU8-lZlRfkV3nj0RzAZdrQ,CONMEBOL,Sports,2269396,0,0,1488
65p2dasDTMU,VAMOS TER MAIS UM FILHO?!😱,2023-11-20T21:00:04Z,UC9eXFedzizQtlY5snZ-IFkg,Sunaika Bruna,Entertainment,638507,55426,0,1176
MJSWjMIdQeE,COMEÇAMOS CONSTRUIR O TOBOÁGUA DA MINHA CASA ABANDONADA!!,2023-11-21T16:51:16Z,UCjTVNkbx5megxlnl1spy2jg,Jully Molinna,Entertainment,292377,16561,0,603
_A-NWVupm2I,"TROQUEI AS MINHAS LENTES, MEUS DENTES NATURAIS ESTÃO ASSIM...",2023-11-21T17:26:05Z,UCZfId64U0uXqaSsAQCsp7Qg,Evelyn Regly,Howto & Style,102306,7260,0,248
jadMjYY2HSw,SOBRE O FIM DO MEU RELACIONAMENTO ❤️‍🩹,2023-11-20T21:32:49Z,UCpO4C7n86oFyCtlpiVPtcDA,By Pamella,Entertainment,381375,46867,0,1615
HU6rDJFPTAw,FUSCÃO PRETO INSANO no The Crew Motorfest,2023-11-21T22:00:12Z,UCYzp8-P162Em-3uZnCuGJOg,Games EduUu,Gaming,743416,107600,0,2641
PPQeqWgw0wI,"O ÚLTIMO A SAIR DA SILVER TAPE, VENCE! (SUPER EXTREMO)",2023-11-21T15:00:07Z,UC2bYhAHyaqfWlPXWBVk4BcA,Enaldinho,Entertainment,1024830,27763,0,726
B1Iq3GYWLIw,Terra recebe mensagem vinda de milhões de km no espaço,2023-11-22T01:00:08Z,UCGV72aVJuWP0QPNGH4YgIww,Olhar Digital,Science & Technology,220664,2344,0,144
aFNUDIFszCA,Evolui de Hacker Pobre até NIVEL MÁXIMO,2023-11-21T13:00:00Z,UCrcBZDofBltcgGxphNia2tw,Problems,Gaming,888062,21926,0,564
x7qi80nxio0,Harry Potter literalmente não faz sentido algum,2023-11-20T15:00:56Z,UCKauw8sGYwEAZ2CMmrI34NQ,Seijinho,Comedy,352746,62600,0,2477
vmQdDTTtt1Y,TESTE: QUAL TIPO DE CRIANÇA VOCÊ FOI?,2023-11-21T13:00:57Z,UCV306eHqgo0LvBf3Mh36AHg,Felipe Neto,Entertainment,791777,82160,0,3509
MqZqBkrOR7o,ENFEITES E ACABAMENTOS DE NATAL COM MATERIAS RECICLÁVEIS | CASA HICKMANN,2023-11-20T23:00:13Z,UCaEDMy0ItPSfPEvJf6wYIxw,Canal Ana Hickmann,People & Blogs,856887,56442,0,3510
o8Oan3SlWhI,"Kyan, Kayin, Danike e KayG - TRAP DE MALOKA (Fahel, 6EE, Nereszz)",2023-11-20T03:00:09Z,UClE9GGSO-HMiiKQUsHyJviA,EHXIS,People & Blogs,580277,42474,0,2112
XYsHgQjJSvk,OLHA ESSE LUGAR... VOCÊ TERIA CORAGEM DE ENTRAR AÍ??? ATRÁS DOS GIGANTES COM ISCA VIVA! Pescaria.,2023-11-20T12:00:25Z,UCFayRsJDx15WyMzZtll6EPQ,Fabio Fregona - BACA,People & Blogs,271346,16510,0,265
88zU6TbGiqY,Five Nights at Freddy's: Help Wanted 2 - Gameplay Release Trailer | PS VR2 Games,2023-11-20T18:00:04Z,UC-2Y8dQb0S6DtpxNgAKoJKA,PlayStation,Gaming,2002296,107721,0,3594
lSAgoddhDG0,Destaques da mecânica de jogo da Temporada 2024 | League of Legends,2023-11-20T16:00:27Z,UC6Xqz2pm50gDCORYztqhDpg,League of Legends Brasil,Gaming,198525,23961,0,1314
G9s-SFLWqNs,LUTAMOS CONTRA A POMNI DO MAL! The amazing digital circus roblox,2023-11-21T21:00:07Z,UC3OGdttknCgXelktBVLKVKQ,MarcelinhaVR,Entertainment,166263,4038,0,65
JqwPCzJnYyY,"Stray Kids ""MEGAVERSE"" Video",2023-11-19T14:59:56Z,UC9rMiEjNaCSsebs31MRDCRA,Stray Kids,People & Blogs,8652156,916364,0,37319
4fzFtfhXOfA,Episódio Completo 10: A última oportunidade de investimentos | 8ª Temporada | Shark Tank Brasil,2023-11-21T00:49:28Z,UCyJ-fWKmF40BQ1FNMMhTPxQ,Shark Tank Brasil,Entertainment,443810,9324,0,784
0M6GWLachlw,Javier Milei fala pela 1ª vez após eleito: “Hoje começa o fim da decadência argentina”,2023-11-20T01:23:46Z,UCP391YRAjSOdM_bwievgaZA,Jovem Pan News,News & Politics,745325,40711,0,6331
Q9qSwDxF6YI,Race Highlights | 2023 Las Vegas Grand Prix,2023-11-19T09:17:05Z,UCB_qr75-ydFVKSF9Dmo6izg,FORMULA 1,Sports,7427538,136148,0,6925
I_5SS4OH_dU,Stray Kids - “S-Class” + “LALALALA” [2023 Billboard Music Awards],2023-11-20T03:20:00Z,UC9ZmFEgVwLieP6FZYtAsy9g,Billboard Music Awards,Entertainment,2193019,258410,0,8022
yiYWNxDpBng,E O NOSSO BEBÊ É... 💜ou 💙 - Chá revelação BABY YASLU,2023-11-19T23:00:34Z,UCALhHwp-p5PVkMLvCkwQvEw,Yasmin Castilho,Entertainment,217846,17082,0,423
z55XlgKzTOQ,MINHA EX ESTA COM CIÚMES DA NICOLLY,2023-11-20T23:15:01Z,UC-kGC1V88JMyT5ligmvPfdg,joao adur,People & Blogs,215620,9199,0,287
b9dQi78WSug,Worlds 2023: Grande Final,2023-11-19T12:03:05Z,UC48rkTlXjRd6pnqqBkdV0Mw,CBLOL,Gaming,460325,17939,0,241
tfyuDylW-Is,O ZANELLA INVADIU MEU QUARTO DE MADRUGADA E VIU O QUE NÃO QUERIA…,2023-11-19T21:30:04Z,UC6nYtmaMh43WUQW5YeopuNg,Eu você e nós,Entertainment,819647,32861,0,1618
Tw0EKb0R28Y,"NewJeans - ""Super Shy"" + ""OMG"" [2023 Billboard Music Awards]",2023-11-20T01:50:00Z,UC9ZmFEgVwLieP6FZYtAsy9g,Billboard Music Awards,Entertainment,3515136,194596,0,5114
